PROJECT,UNIVERSITY OF ALASKA,0214311,2008-35102-19215,Partitioning Behavior Of Pathogen Indicator Microbes In Springtime Meltwater,National Institute of Food and Agriculture,NIFA Non Formula,99951.0,"Schnabel, W. E.",COMPLETE,"water quality, , watershed protection, , zoonotic pathogens, , total suspended solids, , snow management, agricultural waste management, snow lysimeters, , winter survival, , total coliform, , e. coli, , enterococcus, , particulates, , manure"
PROJECT,SAES - UNIVERSITY OF ALASKA,0197421,2003-34158-14063,University of Alaska Southeast Forest Products Program - Year Four,National Institute of Food and Agriculture,NIFA Non Formula,584575.0,"Barber, V. A.",COMPLETE,"forest products, alaska, wood physical properties, strength, wood properties, market surveys, grading, value added, tsuga heterophylla, consumer attitudes, purchasing, agroforestry, resource management, forest resources, food processing, waste utilization, standards, market information, forest economics, economic development, forest industries, industrial structure, market competition, regional economy, composite wood"
PROJECT,Univerisity of Alaska Southeast,0204704,2005-35102-16289,Salmon and Wetland Influences on Carbon and Nutrient Cycling in Forested Watersheds,National Institute of Food and Agriculture,NIFA Non Formula,295000.0,"Hood, E.",COMPLETE,"nutrient cycling, salmon, stable isotopes, wetlands, alaska, carbon, peat, carbon cycle, forest watersheds, forest ecology, hydrology, streams, surface waters, water chemistry, organic matter, fluorescence, fractionation, conifers, watershed management, phosphorus, nitrogen, groundwater, nutrient availability, carcasses, nutrient sources"
PROJECT,SAES - UNIVERSITY OF ALASKA,0203883,2005-34553-15965,"Greenhouse Crop Production, Alaska -II",National Institute of Food and Agriculture,NIFA Non Formula,415769.0,"Karlsson, M. G.",COMPLETE,"greenhouse production, crop production, crop management, controlled environment, budgets, demand, alaska, agricultural economics, beans, tomatoes, vegetables, herbs, cut flowers, small fruit, bedding plants, potted plants, horticultural crops, economic opportunities, information dissemination, guidelines, efficiency, irrigation, fertilization, growing season, protective tunnels"
PROJECT,UNIVERSITY OF ALASKA,0204336,2005-35504-16092,Utilization of Citrus Fruit Peel Waste Materials As a Biosorbent for Heavy Metal Removal From Waste Water,National Institute of Food and Agriculture,NIFA Non Formula,388524.0,"Schiewer, S.",COMPLETE,"heavy metals, pectin, modeling, ph, sorption, citrus, fruit, ions, electrostatics, peel, waste utilization, waste water, alaska, pollution control, algae, polysaccharides, engineering, desorption, mathematical models, ion exchange, binding, mechanisms"
PROJECT,SAES - UNIVERSITY OF ALASKA,0204514,2005-45057-03290,Food Product Development 2005,National Institute of Food and Agriculture,NIFA Non Formula,453304.0,"Dinstel, R. R.",COMPLETE,"antioxidants, food, food products, alaska, wild plants, berries, small businesses, economic development, food economics, cottage industries, diet, food chemistry, food nutritive value, dietary fibers, caloric content, vitamins, recommendations, human nutrition, nutrient requirements, food processing, harvesting, brain, heart, functional foods"
PROJECT,SHELDON JACKSON COLLEGE,0204526,2005-38426-16046,Strengthening Sheldon Jackson College's Education Capacities in Fisheries and Outdoor Leadership,National Institute of Food and Agriculture,NIFA Non Formula,205395.0,"Harrington, M.",COMPLETE,"mariculture, environmental education, community development, fisheries, hatcheries, leadership, colleges, education, education programs, college students, environment, outdoor recreation, opportunities, experience, learning, long term, geography, information dissemination, american indians, alaska, recruitment"
PROJECT,SAES - UNIVERSITY OF ALASKA,0203749,2005-34525-15953,"Ethnobotany Research, Alaska II",National Institute of Food and Agriculture,NIFA Non Formula,262981.0,"Lewis, C. E.",COMPLETE,"native plants, alaska, ethnobotany, pharmaceuticals, nutraceuticals, state government, law, traditionalism, harvesting, research, medicinal plants, policy analysis, american indians, public lands, commercialization, resource management, natural resources, entrepreneurs, guidelines"
PROJECT,UNIVERSITY OF ALASKA SYSTEM,0195273,2003-34385-14055,Alternative Salmon Products Program FY 2003,National Institute of Food and Agriculture,NIFA Non Formula,586021.0,"Smiley, SC.",COMPLETE,"alaska, alternatives, certification, education programs, extension, food economics, food industry, food marketing, food products, food quality, food storage, funding, information dissemination, inspection, market competition, niches, quality maintenance, research programs, seafood, salmon"
PROJECT,SAES - UNIVERSITY OF ALASKA,0197969,2003-34518-14044,Alaska Seed Grower's Assistance Program,National Institute of Food and Agriculture,NIFA Non Formula,301834.0,"Lewis, C. E.",COMPLETE,"seed production, crop production, breeder seed, revegetation, seeds, native plants, alaska, range management, resource management, quality maintenance, production systems, new crops, program planning, agricultural education, education programs, technical assistance, manuals, educational materials, information dissemination, landscaping, weed control, best management practices"
PROJECT,SAES - UNIVERSITY OF ALASKA,0201250,2004-34418-15107,New Crops and Livestock Opportunities V,National Institute of Food and Agriculture,NIFA Non Formula,417884.0,"Lewis, C. E.",COMPLETE,"reindeer, meat processing, muskoxen, radioimmunoassays, animal hormones, leptin, thyroid gland, reproductive performance, livestock management, oilseeds, feed processing, canola, paeonia, haylage, geographic information systems, compaction, baling, irrigation, alaska, chamaecyparis nootkatensis, new crops, economic opportunities, quality maintenance, winter hardiness, value added, profitability, economic viability, validation, peroxides, remote sensing"
PROJECT,SHELDON JACKSON COLLEGE,0200478,2004-38426-14639,Sheldon Jackson College Fisheries and Environmental Sciences: Sustainability Through Community Connections,National Institute of Food and Agriculture,NIFA Non Formula,192613.0,"Harrington, D.",COMPLETE,"collaboration, alaska, environment, work, laboratories, colleges, fisheries, sustained use, rural communities, recruitment, retention, education programs, research equipment, supplies, salmon, nets, pens, aquaculture, low income"
PROJECT,SAES - UNIVERSITY OF ALASKA,0195792,2003-45057-01644,Alaska CES Continuing Food Product Development 03,National Institute of Food and Agriculture,NIFA Non Formula,429192.0,"Long, K. A.",COMPLETE,"cultivated plants, shelf life, food safety, food marketing, nutrition education, sensory evaluation, home processing, extension, alaska, food products, product development, value added, wild plants, recipes, testing, nutrient content, food nutritive value, food preservation, pet food, meat products, kitchens, tomatoes, sauces, smoked meat, fresh produce"
PROJECT,SAES - UNIVERSITY OF ALASKA,0195999,2003-45066-01724,Food Preparation and Marketing for Alaskan Consumers,National Institute of Food and Agriculture,NIFA Non Formula,286128.0,"Long, K. A.",COMPLETE,"alaska, struvite, food safety, food preparation, home processing, extension, fish, food marketing, smoked food, smoking, roe, sea lions, marine organisms, oils, advisory services, rivers, food processing equipment, american indians, food processing, consumers, research, information dissemination, food products, shelf life, food quality, quality maintenance, canning"
PROJECT,SAES - UNIVERSITY OF ALASKA,0205428,2005-34158-16547,University of Alaska: Fairbanks Sitka Forest Products Program Year Six,National Institute of Food and Agriculture,NIFA Non Formula,601892.0,"Barber, V. A.",COMPLETE,"forest products, alaska birch, birch bark, nutraceutical, pharmaceutical, value-added, market survey, consumer reaction, small clear samples, grading rules"
PROJECT,SAES - UNIVERSITY OF ALASKA,0193594,2001-34158-11517,University of Alaska Southeast Forest Products Program (UASFPP) Phase 2,National Institute of Food and Agriculture,NIFA Non Formula,596063.0,"Brackley, A. M.",COMPLETE,"wood properties, technology transfer, alaska, forest products, wood, lumber, energy levels, composite wood, composites, wood pulp, grading, wood quality, betula, forest management, agroforestry, wood engineering, market competition, new products, cost effectiveness, economic development, market development, economic analysis, forest economics, tsuga heterophylla, chamaecyparis"
PROJECT,SAES - UNIVERSITY OF ALASKA,0199706,2004-34553-14568,"Greenhouse Crop Production, Alaska",National Institute of Food and Agriculture,NIFA Non Formula,417884.0,"Karlsson, M. G.",COMPLETE,"marketing, irrigation, fertilization, sanitation, pest control, controlled environment, greenhouse production, raspberries, strawberries, flowering, plant physiology, fruiting, greenhouses, design, control systems, air, crop production, alaska, fruit quality, stress tolerance, agricultural economics, horticultural crops, flowers, herbs, vegetables"
PROJECT,ILISAGVIK COLLEG,0208167,2006-38426-17260,Inupiaq Health Science,National Institute of Food and Agriculture,NIFA Non Formula,50000.0,"Strong, S.",COMPLETE,"health, science, subsistence diets, nutrition, health care professionals, medical terminology, education, teaching, curriculum development"
PROJECT,UNIVERSITY OF ALASKA FAIRBANKS,0220863,2010-85320-20531,Are Alaskan Pollinators Abandoning Native Berries for Exotic Clover?,National Institute of Food and Agriculture,NIFA Non Formula,494000.0,"Mulder, CH, P..",COMPLETE,"Melilotus officinalis, alaska, berry production, blueberry, bog blueberry, boreal forest, bumblebees, interior alaska, invasive plants, lingon berry, lingonberry, melilotus officinalis, pollen quality, pollination, science teachers, sequential mutualism, solitary bees, southcentral alaska, subsistence economy, sweetclover, vaccinium uliginosum, vaccinium vitis-idaea"
PROJECT,EXT - ALASKA COOPERATIVE EXTENSION SERVICE,0226791,2011-41580-30917,"Resilience Through Nurturing, Exploration and Wisdom (ReNEW) Alaska FRTEP",National Institute of Food and Agriculture,NIFA Non Formula,80000.0,"Bacsujlaky, MA.",COMPLETE,"4-h, ALASKA, alaska, alaska native, community engagement, culturally appropriate, experiential learning, participatory research, positive youth development, suicide prevention, tribal programming, tribal youth, youth"
PROJECT,EXT - ALASKA COOPERATIVE EXTENSION SERVICE,1001151,2013-41210-21197,(RACEP) Rural Alaska Citizens Emergency Preparedness,National Institute of Food and Agriculture,NIFA Non Formula,33618.0,"Bacsujlaky, MA.",COMPLETE,alaska
PROJECT,EXT - ALASKA COOPERATIVE EXTENSION SERVICE,1002243,2013-41534-21509,Alaska Extension IPM Coordination Program,National Institute of Food and Agriculture,NIFA Non Formula,36200.0,"Shipka, MI.",COMPLETE,Alaska IPM
PROJECT,UNIVERSITY OF ALASKA FAIRBANKS,1003811,2014-38426-22026,Drumbeats Alaska: Tradition and Science,National Institute of Food and Agriculture,NIFA Non Formula,3057561.0,"Pinney, PE.",ACTIVE,"alaska native, education, ethnobotany, large animal, marine, rural, science, student support"
PROJECT,UNIVERSITY OF ALASKA SOUTHEAST,1000800,2013-38426-21157,"Getting Rural Alaskans into Science Professions (Enhancing Education in Fisheries, Aquaculture and Marine Science for Under-Served Alaskans)",National Institute of Food and Agriculture,NIFA Non Formula,303522.0,"Straley, JA.",COMPLETE,"Getting Rural Alaskans into Science Professions (Enhancing Education in Fisheries, aquaculture"
PROJECT,UNIVERSITY OF ALASKA ANCHORAGE,0220482,2010-85320-20402,Using plant-soil feedback to inform an activated carbon-based restoration program,National Institute of Food and Agriculture,NIFA Non Formula,161911.0,"Kulmatiski, AN.",COMPLETE,"abandoned agriculture, ac, activated carbon, carbon, ex-arable, fungi, intermountain west, invasive, microbe, microbial community, native, plant, plant soil feedback, plant-soil feedback, psf, restoration, shrub-steppe, soil, weed"
PROJECT,UNIVERSITY OF ALASKA FAIRBANKS,0213792,2008-35615-18959,"Assessing the Impacts of Fire & Insect Disturbance on the Terrestrial Carbon Budgets of Forested Areas in Canada, Alaska, & the Western U.S.",National Institute of Food and Agriculture,NIFA Non Formula,254000.0,"McGuire, AN.",COMPLETE,"alaska, canada, carbon cycling, fire, insects, modeling, remote sensing, NACP, alaska, canada, carbon, carbon fire, insects, modis, tem"
PROJECT,UNIVERSITY OF ALASKA FAIRBANKS,0213862,2008-34385-19314,Alternative Salmon Products Special Grants FY 2008,National Institute of Food and Agriculture,NIFA Non Formula,763016.0,"Smiley, SC.",COMPLETE,"adding value, alternative salmon products, analysis chilean salmon farms, carbon monoxide treatment, coho salmon, colorless smoke salmon, listeria monocytogenes, pink chum salmon, regional variations salmon, salmon fatty acids, wild salmon, Aquaculture Salmon, Salmon Fatty Acids, Smoked Salmon, Value Added Salmon, alaskan seafood industry"
PROJECT,UNIVERSITY OF ALASKA FAIRBANKS,0212895,2008-55215-18781,Troth Yeddha`: Nutrition Education and Extension Project,National Institute of Food and Agriculture,NIFA Non Formula,1000000.0,"Simmons, TE.",COMPLETE,"alaska native, curriculum enhancement, health education, health outreach, nutrition, occupational endorsement, prevention outreach, rural alaska, alaska native, diabetes, health education, nutrition, obesity, obesity prevention"
PROJECT,SAES - UNIVERSITY OF ALASKA,0204513,2005-45066-03294,Food Preparation and Marketing 2005,National Institute of Food and Agriculture,NIFA Non Formula,318075.0,"Dinstel, R. R.",COMPLETE,"home economics, food preparation, alaska, cottage industries, distance education, learning, education programs, curriculum, curriculum content, human nutrition, wild plants, berries, food marketing, nutrition education, libraries, educational materials, employment, income, economic opportunities, baseline studies"
PROJECT,UNIVERSITY OF ALASKA FAIRBANKS,0197775,2003-51130-02073,Communities at Risk: Protecting Family Drinking Water in Rural Alaska,National Institute of Food and Agriculture,NIFA Non Formula,598000.0,"White, D. M.",COMPLETE,"drinking water, human health, pathogens, water supply, american indians, alaska, risk, rural communities, rural population, protection, families, pollution control, watershed management, water pollution, microorganisms, waste disposal, education, engineering, sewage, sanitation, indian reservations, students, funding, recruitment, contaminants, chlorination, recommendations"
PROJECT,UNIV OF ALASKA SOUTHEAST SITKA CAMPUS,0198913,2003-38426-14098,Community Wellness Training in Alaska,National Institute of Food and Agriculture,NIFA Non Formula,320346.0,"Etulain, K. S.",COMPLETE,"human nutrition, food safety, human health, communities, well being, training, alaska, families, community services, rural areas, education programs, curriculum, distance education, dietetics, certification, life styles, disease prevention, health care, cost effectiveness"
PROJECT,SAES - UNIVERSITY OF ALASKA,0208034,2006-34553-17526,"Greenhouse Crop Production, Alaska III",National Institute of Food and Agriculture,NIFA Non Formula,277266.0,"Karlsson, M. G.",COMPLETE,"alaska, greenhouse crop production, high tunnel greenhouses, supplemental lighting, tomato, green peppers, bush beans, northern latitude"
PROJECT,UNIVERSITY OF ALASKA SOUTHEAST,0208173,2006-38426-17285,Building Fisheries Technology Program Capacity Through Outreach and Program Expansion,National Institute of Food and Agriculture,NIFA Non Formula,710455.0,"Sullivan, KA.",COMPLETE,"alaska native, aquaculture, distance education, mariculture, rural, technician training, Fisheries Technology Extension, Research and Educational Partnership to Enhance Aquaculture, fisheries"
PROJECT,SAES - UNIVERSITY OF ALASKA,0206843,2006-34525-16984,"Ethnobotany Research, Alaska III",National Institute of Food and Agriculture,NIFA Non Formula,231055.0,"Lewis, C. E.",COMPLETE,"non-timber forest products, harvest, commercial harvest, ethnobotany, regulations, permits, alaska"
PROJECT,SAES - UNIVERSITY OF ALASKA,0204897,2005-34518-16507,Alaska Seed Grower's Assistance Project III,National Institute of Food and Agriculture,NIFA Non Formula,331504.0,"Lewis, C. E.",COMPLETE,"alaska, seed production, crop production, breeder seed, revegetation, weed control, best management practices, native plants, seeds, range management, quality maintenance, plantings, weeds, forbs, manuals, plant adaptation, methodology"
PROJECT,SAES - UNIVERSITY OF ALASKA,0205028,2005-34495-16519,Alaskan Berries: Potential New Products and New Markets,National Institute of Food and Agriculture,NIFA Non Formula,1657518.0,"Lewis, C. E.",COMPLETE,"blueberries, antioxidants, alaska, micropropagation, best management practices, pharmaceuticals, nutraceuticals, controlled environment, crop production, commercialization, nervous system diseases, disease treatment, nutrient disease relations, human diseases, new products, food marketing, food nutritive value, growing season"
PROJECT,UNIVERSITY OF ALASKA FAIRBANKS,0205112,2005-34404-16462,Food Quality Program Special Grant Proposal FY2005,National Institute of Food and Agriculture,NIFA Non Formula,318540.0,"Smiley, SC.",COMPLETE,"alaska, bacterial diseases, canned foods, disease incidence, education programs, extension programs, fish, food, food contamination, food processing, food quality, food safety, funding, human diseases, odor, oysters, research programs, salmon, shellfish, vibrio parahaemolyticus, water temperature, vibrio"
PROJECT,UNIVERSITY OF ALASKA SYSTEM,0200078,2004-34422-15179,"Seafood Harvesting, Processing and Marketing Program FY2004",National Institute of Food and Agriculture,NIFA Non Formula,996422.0,"Smiley, SC.",COMPLETE,"alaska, animal physiology, aquaculture, cod, collaboration, education programs, environmental stress, extension, fillets, fish, fish products, flounder, food marketing, food processing, halibut, harvesting, marine fish, microwave cookery, microwave radiation, new products, new technology, pollock, product quality, quality maintenance, research programs, salmon, sharks, striped bass, thermal processing, Advanced Thermal Processing Technology, Chalky Halibut, Fillet Operations, Inject Fillets, Pacific Cod, Pollock, Salmon Products, Seafood Harvesting, Seafood marketing, Sole, Spiny Dogfish, Undersized flatfish, aquaculture, marine finfish aquaculture, microwave technology, rockfish, seafood, seafood processing"
PROJECT,UNIVERSITY OF ALASKA SYSTEM,0200155,2004-34385-15035,CSREES Special Grant:  Alternative Salmon Products Program FY2004,National Institute of Food and Agriculture,NIFA Non Formula,527463.0,"Smiley, SC.",COMPLETE,"alaska, bruising, cod, collaboration, education, extension, fat content, fatty acids, fillets, fish, fish products, food industry, food nutritive value, food processing, harvesting, hydrolysis, infant formulas, lipids, meat quality, new technology, powders, product quality, profiles, proteins, research programs, seafood, underutilized species, wild fish, alternative salmon products, edible protein powders, infant formulae, salmon, salmon, underutilized fish"
PROJECT,SAES - UNIVERSITY OF ALASKA,0200299,2004-45057-03009,Food Product Development: 2004,National Institute of Food and Agriculture,NIFA Non Formula,386506.0,"Dinstel, R. R.",COMPLETE,"value added, antioxidants, shelf life, food safety, education, sensory evaluation, extension, alaska, food products, product development, wild plants, recipes, kitchens, nutrient content, food nutritive value, education programs, food preservation, cooperative research, meat, reindeer, berries, food handling, food storage, picking, food flavor, warmed over flavor, processed food"
PROJECT,UNIVERSITY OF ALASKA,0200477,2004-38426-14638,Year 4: A Collaboration Between the College of Rural Alaska Extended Campuses and the Alaska Cooperative Extension Service,National Institute of Food and Agriculture,NIFA Non Formula,831847.0,"Nakazawa, A.",COMPLETE,"extension, collaboration, curriculum, technology, alaska, colleges, rural areas, curriculum content, education, education programs, partnerships, middle schools, secondary schools, natural resources, demonstration"
PROJECT,SAES - UNIVERSITY OF ALASKA,0199860,2004-34495-14459,"Berry Research, AK II",National Institute of Food and Agriculture,NIFA Non Formula,167153.0,"Karlsson, M. G.",COMPLETE,"controlled environment, berries, greenhouse production, beneficial insects, pest management, irrigation, fertilization, raspberries, strawberries, day length, crop production, alaska, stress tolerance, pre harvest, fruit quality, agricultural economics, production management, market analysis, economic analysis, demand, food, economic potential, vegetables, flowers, facilities, greenhouses, farm equipment, instrumentation, agricultural engineering"
PROJECT,SAES - UNIVERSITY OF ALASKA,0220191,2010-65504-20379,Carbon Hydrogen Nitrogen Elemental Analysis for Biomass and Biofuel Research,National Institute of Food and Agriculture,NIFA Non Formula,28976.0,"Soria, J. A.",COMPLETE,"carbon, hydrogen, nitrogen, chn elemental analyzer, biomass, biofuel, biobased wood products, alaska"
PROJECT,SAES - UNIVERSITY OF ALASKA,0224181,2011-68004-20091,Identifying Strategies to Develop Sustainable Livestock Production in Alaska,National Institute of Food and Agriculture,NIFA Non Formula,48845.0,"Rowell, JA, E..",COMPLETE,"ALASKA, Food security, Livestock production systems, alaska, conference, food security, food sustainability, high latitude agriculture, livestock production, ruminant, sustainable agriculture"
PROJECT,UNIVERSITY OF ALASKA SOUTHEAST,0225836,2011-38426-30605,"Connecting Pacific Pathways through Research, Education and Experience in the Sciences (renewal)",National Institute of Food and Agriculture,NIFA Non Formula,310400.0,"Straley, JA.",COMPLETE,"biological sciences, communication skills, distance delivery, enhanced capacity for research, experiential learning, field methods, institutional collaboration, laboratory methods, land and, mentoring, molecular ecology, resource management, rural and native alaskans, scientific research, watershed management"
PROJECT,EXT - ALASKA COOPERATIVE EXTENSION SERVICE,1000313,2013-41580-20791,Vibrant Communities Through Resilient Youth (VCTRY),National Institute of Food and Agriculture,NIFA Non Formula,226800.0,"Bacsujlaky, MA.",ACTIVE,alaska
PROJECT,EXT - ALASKA COOPERATIVE EXTENSION SERVICE,1001405,2013-46100-21520,Connections to Life,National Institute of Food and Agriculture,NIFA Non Formula,199999.0,"Jones, DE.",COMPLETE,alaska
PROJECT,ILISAGVIK COLLEGE,1003191,2014-38421-22015,Science and Health Education Outreach,National Institute of Food and Agriculture,NIFA Non Formula,208615.0,"Sialofi, AM.",ACTIVE,Science and Healthcare
PROJECT,EXT - ALASKA COOPERATIVE EXTENSION SERVICE,1004853,2014-70006-22558,Crop Protection and Pest Management for Alaska`s Emerging Farmers and Ranchers,National Institute of Food and Agriculture,NIFA Non Formula,340000.0,"Seefeldt, ST.",ACTIVE,alaska
PROJECT,SAES - UNIVERSITY OF ALASKA,0189115,2001-34418-10794,New Crops Opportunities,National Institute of Food and Agriculture,NIFA Non Formula,462943.0,"Lewis, C. E.",COMPLETE,"small fruit, crop production, oplopanax horridus, canola, paeonia, reindeer, salt tolerance, wild flowers, antioxidants, revegetation, betula, sap, bark, nutrient uptake (plants), carbon, new crops, agroforestry, forest management, reproductive performance, value added, alaska, agricultural economics, economic opportunities, crop quality, betula papyrifera, picea mariana, seedlings, raspberries, blackberries, blueberries, mycorrhizae"
PROJECT,UNIVERSITY OF ALASKA FAIRBANKS,0192391,2002-34422-12136,"Seafood Harvesting, Processing and Marketing Program",National Institute of Food and Agriculture,NIFA Non Formula,1068183.0,"Smiley, S. T.",COMPLETE,"seafood, alaska, chitosan, coatings, surimi, image analysis, fish, certification, quality maintenance, food quality, food marketing, harvesting, food processing, agricultural economics, food spoilage, sustainable agriculture, moisture content, fish population, feasibility, market analysis, consumer surveys, laboratory tests, product evaluation, school lunches, focus groups, data analysis, reports"
PROJECT,SAES - UNIVERSITY OF ALASKA,0193027,2002-34418-12363,New Crops for New Markets,National Institute of Food and Agriculture,NIFA Non Formula,453650.0,"Lewis, C. E.",COMPLETE,"brassica, antioxidants, economic analysis, reindeer, new crops, market development, markets, seedlings, lingonberries, wheat, carbon, cropping systems, livestock management, alaska, forest products, milling quality, milling (grain), progestins, reproductive performance, soil properties, boreal forests, forest soils, value added, economic development"
PROJECT,SITKA SOUND SCIENCE CENTER INC.,0225551,2011-38414-30478,Taking AME (Aquaculture and Marine Education):Preparing Southeast Alaska for careers in aquaculture and marine science.,National Institute of Food and Agriculture,NIFA Non Formula,136540.0,"Busch, LI, JE.",COMPLETE,"K-8 classroom, Southeast Alaska, aquaculture, aquaculture education, careers in aquaculture and marine education, food security, k-12 education, marine science education, sitka sound science center, southeast alaska, taking ame"
PROJECT,EXT - ALASKA COOPERATIVE EXTENSION SERVICE,1000136,2013-41580-20782,"Promoting Healthy and Thriving Tribes in Remote, Interior Alaska",National Institute of Food and Agriculture,NIFA Non Formula,241800.0,"Rader, HE.",ACTIVE,"ALASKA, Alaska Tanana Chiefs Conference, alaska"
